{
  "usageId": "usage-001",
  "requestId": "req-001",
  "userId": "user-demo",
  "organizationId": null,
  "featureId": "CALPQ-M10-DEMO",
  "taskType": "RECOMMENDATION_EXPLANATION",
  "fundingSource": "USER",
  "payerId": "user-demo",
  "provider": "provider-adapter-a",
  "model": "model-small",
  "executionTier": "L5",
  "inputUnits": 1000,
  "cachedInputUnits": 0,
  "outputUnits": 200,
  "toolUnits": 0,
  "providerCost": 0.002,
  "variableInfrastructureCost": 0.0005,
  "chargedAmount": 0.01,
  "revenue": 0.01,
  "currency": "EUR",
  "rateCardVersion": "2026-09-23.1",
  "budgetReservationId": "reservation-001",
  "cacheHit": false,
  "createdAt": "2026-09-23T00:00:01Z",
  "unfundedCost": 0
}
